{
  "$schema": "../schemas/master-data-registry.schema.json",
  "registryVersion": "2.35.0",
  "effectiveFrom": "2026-09-07",
  "description": "Canonical bootstrap reference data. Database migrations must preserve these stable codes and audit later changes.",
  "collections": {
    "channels": [
      {
        "code": "OOH",
        "displayLabel": "Out of Home",
        "isActive": true,
        "sortOrder": 10,
        "metadata": {
          "supportsGeography": true,
          "isDigital": false,
          "requiresCoordinates": true,
          "defaultInventoryProductType": "OOH_SITE",
          "benchmarkFamily": "OOH_LOCAL",
          "briefTerms": [
            "ooh",
            "out of home",
            "billboard",
            "billboards",
            "gantry",
            "static ooh",
            "static site",
            "static sites",
            "iconic static",
            "static branding",
            "wall mural",
            "wall murals",
            "taxi rank branding",
            "bus branding",
            "venue branding",
            "court branding",
            "static / digital",
            "static/digital"
          ]
        }
      },
      {
        "code": "DOOH",
        "displayLabel": "Digital Out of Home",
        "isActive": true,
        "sortOrder": 20,
        "metadata": {
          "supportsGeography": true,
          "isDigital": true,
          "requiresCoordinates": true,
          "defaultInventoryProductType": "DOOH_SCREEN",
          "benchmarkFamily": "OOH_LOCAL",
          "briefTerms": [
            "dooh",
            "digital out of home",
            "digital billboard",
            "digital screen",
            "digital large format",
            "digital site",
            "digital sites",
            "static / digital",
            "static/digital"
          ]
        }
      },
      {
        "code": "RADIO",
        "displayLabel": "Radio",
        "isActive": true,
        "sortOrder": 30,
        "metadata": {
          "defaultInventoryProductType": "RADIO_SPOT",
          "briefTerms": [
            "radio",
            "fm",
            "audio spot"
          ]
        }
      },
      {
        "code": "TV",
        "displayLabel": "Television",
        "isActive": true,
        "sortOrder": 40,
        "metadata": {
          "defaultInventoryProductType": "TV_SPOT",
          "briefTerms": [
            "television",
            "tv",
            "broadcast"
          ]
        }
      },
      {
        "code": "PRINT",
        "displayLabel": "Print",
        "isActive": true,
        "sortOrder": 50,
        "metadata": {
          "defaultInventoryProductType": "PRINT_PLACEMENT",
          "briefTerms": [
            "print",
            "newspaper",
            "magazine"
          ]
        }
      },
      {
        "code": "DIGITAL",
        "displayLabel": "Digital",
        "isActive": true,
        "sortOrder": 60,
        "metadata": {
          "defaultInventoryProductType": "DIGITAL_PLACEMENT",
          "briefTerms": [
            "digital media",
            "online advertising",
            "search advertising",
            "display advertising"
          ]
        }
      },
      {
        "code": "SOCIAL",
        "displayLabel": "Social Media",
        "isActive": true,
        "sortOrder": 70,
        "metadata": {
          "defaultInventoryProductType": "SOCIAL_PLACEMENT",
          "briefTerms": [
            "social media",
            "facebook",
            "instagram",
            "tiktok",
            "linkedin"
          ]
        }
      },
      {
        "code": "INFLUENCER",
        "displayLabel": "Influencer",
        "isActive": true,
        "sortOrder": 80,
        "metadata": {
          "defaultInventoryProductType": "INFLUENCER_PACKAGE",
          "briefTerms": [
            "influencer",
            "creator"
          ]
        }
      },
      {
        "code": "EXPERIENTIAL",
        "displayLabel": "Experiential",
        "isActive": true,
        "sortOrder": 90,
        "metadata": {
          "defaultInventoryProductType": "EXPERIENCE",
          "briefTerms": [
            "experiential",
            "activation",
            "event activation"
          ]
        }
      },
      {
        "code": "PODCAST",
        "displayLabel": "Podcast",
        "isActive": true,
        "sortOrder": 100,
        "metadata": {
          "defaultInventoryProductType": "PODCAST_SPOT",
          "briefTerms": [
            "podcast",
            "podcast sponsorship"
          ]
        }
      },
      {
        "code": "RETAIL",
        "displayLabel": "Retail Media",
        "isActive": true,
        "sortOrder": 110,
        "metadata": {
          "defaultInventoryProductType": "RETAIL_PLACEMENT",
          "briefTerms": [
            "retail media",
            "in-store media"
          ]
        }
      },
      {
        "code": "TRANSIT",
        "displayLabel": "Transit",
        "isActive": true,
        "sortOrder": 120,
        "metadata": {
          "defaultInventoryProductType": "TRANSIT_PLACEMENT",
          "briefTerms": [
            "transit media",
            "bus advertising",
            "taxi advertising"
          ]
        }
      },
      {
        "code": "MALL",
        "displayLabel": "Mall Media",
        "isActive": true,
        "sortOrder": 130,
        "metadata": {
          "defaultInventoryProductType": "MALL_PLACEMENT",
          "briefTerms": [
            "mall media",
            "shopping centre media"
          ]
        }
      },
      {
        "code": "EMAIL",
        "displayLabel": "Email",
        "isActive": true,
        "sortOrder": 140,
        "metadata": {
          "defaultInventoryProductType": "EMAIL_PLACEMENT",
          "briefTerms": [
            "email marketing",
            "newsletter"
          ]
        }
      },
      {
        "code": "MOBILE",
        "displayLabel": "Mobile",
        "isActive": true,
        "sortOrder": 150,
        "metadata": {
          "defaultInventoryProductType": "MOBILE_PLACEMENT",
          "briefTerms": [
            "mobile advertising",
            "sms",
            "ussd"
          ]
        }
      }
    ],
    "roles": [
      {
        "code": "platform_admin",
        "displayLabel": "Platform Administrator",
        "isActive": true,
        "sortOrder": 10
      },
      {
        "code": "internal_planner",
        "displayLabel": "Internal Planner",
        "isActive": true,
        "sortOrder": 20
      },
      {
        "code": "inventory_ops",
        "displayLabel": "Inventory Operations",
        "isActive": true,
        "sortOrder": 30
      },
      {
        "code": "agency_admin",
        "displayLabel": "Agency Administrator",
        "isActive": true,
        "sortOrder": 40
      },
      {
        "code": "agency_campaign_user",
        "displayLabel": "Agency Campaign User",
        "isActive": true,
        "sortOrder": 50
      },
      {
        "code": "advertiser_admin",
        "displayLabel": "Advertiser Administrator",
        "isActive": true,
        "sortOrder": 60
      },
      {
        "code": "advertiser_approver",
        "displayLabel": "Advertiser Approver",
        "isActive": true,
        "sortOrder": 70
      },
      {
        "code": "supplier_admin",
        "displayLabel": "Supplier Administrator (retired)",
        "isActive": false,
        "sortOrder": 80
      },
      {
        "code": "supplier_user",
        "displayLabel": "Supplier User",
        "isActive": true,
        "sortOrder": 90
      },
      {
        "code": "influencer_rep",
        "displayLabel": "Influencer Representative",
        "isActive": true,
        "sortOrder": 100
      },
      {
        "code": "agent_runtime_service",
        "displayLabel": "Agent Runtime Service",
        "isActive": true,
        "sortOrder": 110
      },
      {
        "code": "worker_service",
        "displayLabel": "Worker Service",
        "isActive": true,
        "sortOrder": 120
      }
    ],
    "permissions": [
      {
        "code": "workspace_read",
        "displayLabel": "View own workspaces",
        "isActive": true,
        "sortOrder": 10,
        "metadata": {
          "roles": [
            "platform_admin",
            "internal_planner",
            "inventory_ops",
            "agency_admin",
            "agency_campaign_user",
            "advertiser_admin",
            "advertiser_approver",
            "supplier_user",
            "influencer_rep"
          ]
        }
      },
      {
        "code": "tenant_read",
        "displayLabel": "View tenant profile",
        "isActive": true,
        "sortOrder": 20,
        "metadata": {
          "roles": [
            "platform_admin",
            "internal_planner",
            "inventory_ops",
            "agency_admin",
            "agency_campaign_user",
            "advertiser_admin",
            "advertiser_approver",
            "supplier_user",
            "influencer_rep"
          ]
        }
      },
      {
        "code": "tenant_manage",
        "displayLabel": "Manage tenant profile",
        "isActive": true,
        "sortOrder": 30,
        "metadata": {
          "roles": [
            "platform_admin",
            "agency_admin",
            "advertiser_admin",
            "supplier_user",
            "influencer_rep"
          ]
        }
      },
      {
        "code": "user_read_self",
        "displayLabel": "View own user profile",
        "isActive": true,
        "sortOrder": 40,
        "metadata": {
          "roles": [
            "platform_admin",
            "internal_planner",
            "inventory_ops",
            "agency_admin",
            "agency_campaign_user",
            "advertiser_admin",
            "advertiser_approver",
            "supplier_user",
            "influencer_rep"
          ]
        }
      },
      {
        "code": "user_manage_self",